{
  "$schema": "http://json-schema.org/draft-07/schema#",
  "$id": "https://raw.githubusercontent.com/brandflowr/SKELETON-Brandflowr/v2.10.0/spec/bone.schema.json",
  "$comment": "Versioned, immutable release URL (git tag v2.10.0); 'main' carries the latest. See GOVERNANCE.md.",
  "title": "BONE — Base Object Narrative Export",
  "description": "A plugin definition format for attaching AI generation config to SKEL story entities.",
  "type": "object",
  "required": ["bone_id", "bone_version", "label", "target", "attaches_to", "fields"],
  "additionalProperties": false,
  "patternProperties": {
    "^x-": {
      "description": "Vendor-specific namespaced extension data.",
      "type": "object"
    }
  },
  "properties": {
    "$schema": { "type": "string" },
    "bone_id": {
      "type": "string",
      "pattern": "^[a-z0-9][a-z0-9\\-]*$",
      "description": "Unique identifier. Lowercase alphanumeric with hyphens."
    },
    "bone_version": {
      "type": "string",
      "pattern": "^\\d+\\.\\d+(\\.\\d+)?$",
      "description": "Semver version. MAJOR.MINOR required; PATCH optional."
    },
    "label": {
      "type": "string",
      "description": "Human-readable display name."
    },
    "description": {
      "type": "string",
      "description": "What this BONE does."
    },
    "target": {
      "type": "string",
      "enum": ["image", "video", "audio", "style", "custom"],
      "description": "Primary category of this BONE."
    },
    "provider": {
      "type": "string",
      "pattern": "^[a-z0-9][a-z0-9\\-]*$",
      "description": "Optional provider namespace, such as higgsfield, runway, kling, or flux."
    },
    "prompt_skill": {
      "type": "string",
      "description": "Optional skill package that supplies provider-specific prompt authoring guidance."
    },
    "attaches_to": {
      "type": "array",
      "items": {
        "type": "string",
        "enum": ["metadata", "act", "scene", "shot", "character", "environment"]
      },
      "minItems": 1,
      "description": "Which SKEL entity types this BONE can attach to. character/environment attachment targets studio-registry or embedded asset entities (e.g. a per-character reference sheet)."
    },
    "fields": {
      "type": "object",
      "additionalProperties": {
        "$ref": "#/definitions/FieldDef"
      },
      "description": "Field definitions describing the expected data shape."
    },
    "defaults": {
      "type": "object",
      "description": "Default values for fields."
    },
    "prompt_assembly": { "$ref": "#/definitions/PromptAssembly" },
    "llm_instructions": {
      "type": "object",
      "description": "Generator-specific writing guidance for LLM prompt authors.",
      "additionalProperties": true
    },
    "output": {
      "type": "object",
      "description": "Render output format, target, storage template, and write-back behavior.",
      "additionalProperties": true
    },
    "routing": {
      "type": "object",
      "description": "Optional provider routing metadata or lookup hints. Projects may also keep routing in external config.",
      "additionalProperties": true
    },
    "execution": {
      "type": "object",
      "description": "Legacy executable route metadata used by existing BONE definitions.",
      "additionalProperties": true
    },
    "execution_routes": {
      "type": "array",
      "description": "Optional executable routes the agent can choose from, such as MCP, CLI, or skill package routes.",
      "items": { "$ref": "#/definitions/ExecutionRoute" }
    },
    "extensions": {
      "type": "object",
      "description": "Vendor-specific extension data. Keys should be x- namespaced.",
      "additionalProperties": true
    },
    "requires": {
      "type": "array",
      "items": { "type": "string" },
      "description": "Capability ids this BONE needs in order to fire. Hosts join these against their capability matrix to mark the BONE armed / needs-setup / unavailable."
    },
    "pipeline_stage": {
      "type": "string",
      "description": "Optional pipeline stage this BONE participates in (e.g. proposal, scene_plan, generation, review)."
    },
    "authoring_mode": {
      "type": "string",
      "anyOf": [
        { "enum": ["templated", "atelier", "hybrid"] },
        { "pattern": "^x-" }
      ],
      "description": "Templated (fast, consistent, reusable), Atelier/Bespoke (hand-crafted, higher distinctiveness), or Hybrid (templated base with bespoke passes). Absence = unset."
    },
    "render_runtime": {
      "type": "string",
      "anyOf": [
        { "enum": ["native", "remotion", "hyperframes", "ffmpeg"] },
        { "pattern": "^x-" }
      ],
      "description": "Preferred composition runtime. Governance/selector metadata only — does not execute a render."
    },
    "style_tokens": {
      "type": "object",
      "additionalProperties": true,
      "description": "Optional color/typography/motion/grading/caption/a11y tokens for style-family BONEs."
    },
    "decision_log_refs": {
      "type": "array",
      "items": { "type": "string" },
      "description": "IDs of host decision-log entries that motivated or constrain this BONE."
    },
    "quality_gates": {
      "type": "array",
      "items": { "$ref": "#/definitions/QualityGate" },
      "description": "Optional quality gates this BONE must satisfy — governance metadata for host reviewer surfaces."
    }
  },
  "definitions": {
    "QualityGate": {
      "type": "object",
      "additionalProperties": true,
      "required": ["severity", "message"],
      "description": "A quality gate a BONE declares it must satisfy, shaped like a reviewer finding (inlined to keep this schema self-contained). Runtime-only fields (id/timestamp) are optional because a BONE declares gates rather than emitting findings.",
      "properties": {
        "severity": { "type": "string" },
        "message": { "type": "string" },
        "id": { "type": "string" },
        "timestamp": { "type": "string" }
      }
    },
    "PromptAssembly": {
      "type": "object",
      "required": ["strategy"],
      "additionalProperties": false,
      "description": "Prompt assembly strategy and context injection rules.",
      "properties": {
        "strategy": {
          "type": "string",
          "enum": ["template", "sequential", "raw"]
        },
        "template": {
          "type": "string",
          "description": "Template string using {{field_name}} and supported system tokens."
        },
        "v_setup_injection": { "$ref": "#/definitions/VSetupInjection" },
        "character_injection": { "$ref": "#/definitions/CharacterInjection" },
        "max_length": {
          "type": "integer",
          "minimum": 1,
          "description": "Maximum assembled prompt length in characters."
        },
        "separator": {
          "type": "string",
          "description": "Separator used by sequential assembly. Defaults to a single space."
        }
      },
      "allOf": [
        {
          "if": {
            "properties": { "strategy": { "const": "template" } },
            "required": ["strategy"]
          },
          "then": { "required": ["template"] }
        }
      ]
    },
    "VSetupInjection": {
      "type": "object",
      "additionalProperties": true,
      "properties": {
        "enabled": { "type": "boolean", "default": false },
        "position": { "type": "string", "enum": ["append", "prepend", "inline"] },
        "token_format": { "type": "string", "enum": ["natural", "technical", "none"] },
        "tokens": {
          "type": "array",
          "items": {
            "type": "string",
            "enum": ["size", "angle", "lens", "move", "light", "tod", "dof", "aspect", "color", "mood", "custom"]
          }
        }
      }
    },
    "CharacterInjection": {
      "type": "object",
      "additionalProperties": true,
      "properties": {
        "enabled": { "type": "boolean", "default": false },
        "position": { "type": "string", "enum": ["prepend", "append", "subject_prefix"] },
        "format": { "type": "string", "enum": ["name_only", "name_and_description", "consistency_modifier"] }
      }
    },
    "ExecutionRoute": {
      "type": "object",
      "required": ["type"],
      "additionalProperties": true,
      "properties": {
        "type": {
          "type": "string",
          "enum": ["mcp", "cli", "skill", "api", "manual"]
        },
        "label": { "type": "string" },
        "tool": { "type": "string" },
        "command": { "type": "string" },
        "endpoint": { "type": "string" },
        "requires": {
          "type": "array",
          "items": { "type": "string" }
        },
        "args": {
          "type": "object",
          "additionalProperties": true
        }
      }
    },
    "FieldDef": {
      "type": "object",
      "required": ["type", "required"],
      "additionalProperties": true,
      "properties": {
        "type": {
          "type": "string",
          "enum": ["string", "number", "boolean", "array", "object"]
        },
        "required": { "type": "boolean" },
        "ui": {
          "type": "string",
          "enum": ["text", "textarea", "number", "slider", "select", "toggle", "color", "file"]
        },
        "label": { "type": "string" },
        "description": { "type": "string" },
        "default": {},
        "min": { "type": "number" },
        "max": { "type": "number" },
        "options": { "type": "array" }
      }
    }
  }
}
